{
  "id": "cana.continuation-kernel",
  "version": "0.1.0",
  "description": "Durable, database-owned continuation state: CANA remembers what must happen later, knows what it is waiting for, and wakes missions by time, event, condition, dependency, follow-up, revalidation or learning triggers. External runtimes tick it; none of them own it.",
  "domain": "continuation",
  "real_outcome": "A conversation ending, a model failing, or a machine restarting never erases a future mission.",
  "authority_class": "OBSERVE_ONLY",
  "reversibility": "Triggers cancel/expire; receipts are append-only and hash-chained (deliberately not erasable).",
  "canonical_actions": [
    { "action_id": "continuation.create-mission", "description": "Create a bounded durable mission", "entry": "apps/web/src/lib/continuation/continuation-repository.mjs#createMission" },
    { "action_id": "continuation.create-trigger", "description": "Create a bounded trigger (rejected without purpose/stop/budget/ceiling/expiry)", "entry": "apps/web/src/lib/continuation/continuation-repository.mjs#createTrigger" },
    { "action_id": "continuation.approve", "description": "The ONLY path arming EFFECTFUL work", "entry": "apps/web/src/lib/continuation/continuation-repository.mjs#approveTrigger" },
    { "action_id": "continuation.tick", "description": "Evaluate durable state (exactly-once firing; any runtime may invoke)", "entry": "apps/web/scripts/continuation-tick.mjs" }
  ],
  "evidence_hooks": [
    "ContinuationReceipt hash chain per mission (tamper-evident, verifyReceiptChain)",
    "worker JSONL audit line per cron tick (deploy/namecheap/worker.mjs continuation-tick job)"
  ],
  "continuation_hooks": ["consumed by cana.ask-orderweeddc (FOLLOW_UP) and the provenance court (REVALIDATION)"],
  "backend_adapters": ["cPanel cron via deploy/namecheap/worker.mjs", "any runtime able to run node apps/web/scripts/continuation-tick.mjs"],
  "status": "STRUCTURALLY_VALIDATED"
}
